<?xml version="1.0" encoding="UTF-8" ?>
<excel xmlns:xsi="http://www.w3.org/2001/XMLSchema-instance"
xsi:noNamespaceSchemaLocation="http://www.bana.com/common-util/excelConfig.xsd" 
type="xls" name="学生成绩单" style="border:all;fontName:微软雅黑;">
	<sheet name="学生成绩单" checkTitle="true">
		<row type="title" rowIndex="-1" style="fontWeight:bold;fontHeightInPoints:14;alignment:ALIGN_CENTER;"><!-- 列按照顺序进行排列 -->
			<column name="学生成绩单" colspan="10"/>
		</row>
		<row type="title" mutiTitle="true" rowIndex="-1" style="fontHeightInPoints:10;"><!-- 列按照顺序进行排列 -->
			<column name="序号" />
			<column name="成绩单" colspan="1"/>
			<column name="学生编号" colspan="1"/>
			<column name="学生姓名" colspan="1"/>
			<column name="班级名称" colspan="1"/>
			<column name="科目" colspan="1"/>	
			<column name="成绩" colspan="1"/>
			<column name="考试日期" colspan="1"/>	
			<column name="老师评语" colspan="1"/>	
			<column name="发布人" colspan="1"/>			
		</row>
		<row type="data" rowIndex="-1" style="fontHeightInPoints:10;" class="org.bana.common.util.office.impl.StudentScoreDto4Query">
			<column name="序号" mappedBy="@index" style="dataFormat:#"/>
			<column name="成绩单" mappedBy="title"/>
			<column name="学生编号" mappedBy="studentId" style="dataFormat:#" type="long"/>
			<column name="学生姓名" mappedBy="studentName"/>
			<column name="班级名称" mappedBy="classOrgName"/>
			<column name="科目" mappedBy="subject"/>
			<column name="成绩" mappedBy="score"/>
			<column name="考试日期" mappedBy="examinationTime"  type="date"/>
			<column name="老师评语" mappedBy="comment"/>
			<column name="发布人" mappedBy="createName"/>
		</row>
	</sheet>
</excel>
