<?xml version="1.0" encoding="UTF-8" ?>
<excel xmlns:xsi="http://www.w3.org/2001/XMLSchema-instance"
xsi:schemaLocation="http://www.bana.com/excelConfig
	http://www.bana.com/common-util/excelConfig.xsd"
type="xls" name="测试名称" style="border:all;fontName:微软雅黑;" baseFile="/office/学生成绩单模版-科目横版-v1.1 - 副本.xls">
	<sheet name="sheet1-test">
		<row type="title" rowIndex="5" style="fontWeight:bold;"><!-- 列按照顺序进行排列 -->
			<column name="系统用户统计数据" colspan="7"/>
		</row>
		<row type="title" rowIndex="-1"><!-- 列按照顺序进行排列 -->
			<column name="序号" />
			<column name="姓名" colspan="1" style="fillForegroundColor:yellow;"/>
			<column name="性别" colspan="2"/>
			<column name="年龄" colspan="1" style="fillForegroundColor:red;"/>
			<column name="住址" colspan="1" style="fillForegroundColor:dark_blue;"/>
			<column name="日期" colspan="1"/>
		</row>
		<row type="data" class="org.bana.common.util.office.annotation.TestData" rowIndex="-1">
			<column mappedBy="@index"/>
			<column mappedBy="name"/>
			<column mappedBy="sex" colspan="2"/>
			<column mappedBy="age" style="dataFormat:#" type="int" useDic="true" dicType="postal_bank_money_type"/>
			<column mappedBy="address"/>
			<column mappedBy="date" style="dataFormat:yyyy年MM月dd日 HH时mm分ss秒;" type="date"/>
		</row>
	</sheet>
</excel>
